Название,Цена,Ссылка
Диван Льери Мини Velvet Light,84490,https://www.divan.ru/irkutsk/product/divan-leri-mini-velvet-light
Диван Нумо Velvet Yellow,48090,https://www.divan.ru/irkutsk/product/divan-numo-velvet-yellow
Диван угловой Эби-1 Velvet Coral,94890,https://www.divan.ru/irkutsk/product/divan-uglovoj-ebi-1-velvet-coral
Диван Бонент Velvet Eclipse,97490,https://www.divan.ru/irkutsk/product/divan-bonent-velvet-eclipse
Диван Нумо Мини Textile Yellow,32490,https://www.divan.ru/irkutsk/product/divan-numo-mini-textile-yellow
Диван Линс Velvet Navy Blue,42890,https://www.divan.ru/irkutsk/product/divan-lins-velvet-navy-blue
Диван угловой Эдвин Velvet Smoke,94890,https://www.divan.ru/irkutsk/product/divan-uglovoj-edvin-velvet-smoke
Диван Бруквиль Velvet Blue,64990,https://www.divan.ru/irkutsk/product/divan-brukvil-velvet-blue
Диван Байма Velvet Grey,90990,https://www.divan.ru/irkutsk/product/divan-bajma-velvet-grey
Диван Спейс Velvet Beige,81890,https://www.divan.ru/irkutsk/product/divan-spejs-velvet-beige
Диван угловой Беллер Textile Yellow,53290,https://www.divan.ru/irkutsk/product/divan-uglovoj-beller-textile-yellow
Кресло Бенел Cozy Ivory,44190,https://www.divan.ru/irkutsk/product/kreslo-benel-cozy-ivory
Диван Нумо Velvet Grafit,48090,https://www.divan.ru/irkutsk/product/divan-numo-velvet-grafit
Кресло-кровать Маре Мини Velvet Grafit,28590,https://www.divan.ru/irkutsk/product/kreslo-krovat-mare-mini-velvet-grafit
Диван Клаймар Velvet Beige,74090,https://www.divan.ru/irkutsk/product/divan-klajmar-velvet-beige
Диван Марей Soft Grey,116990,https://www.divan.ru/irkutsk/product/divan-marej-soft-grey
Диван Сваут Velvet Grey,84490,https://www.divan.ru/irkutsk/product/divan-svaut-velvet-grey
Кресло Бенел Cozy Beige,44190,https://www.divan.ru/irkutsk/product/kreslo-benel-cozy-beige
Диван Линс Velvet Grafit,42890,https://www.divan.ru/irkutsk/product/divan-lins-velvet-grafit
Диван угловой Аронт Мини Velvet Pink,74090,https://www.divan.ru/irkutsk/product/divan-uglovoj-aront-mini-velvet-pink
Диван Рейли Velvet Coral,48090,https://www.divan.ru/irkutsk/product/divan-rejli-velvet-coral
Диван угловой Вайвел Barhat Forest,116990,https://www.divan.ru/irkutsk/product/divan-uglovoj-vajvel-barhat-forest
Диван Бруквиль Velvet Smoke,64990,https://www.divan.ru/irkutsk/product/divan-brukvil-velvet-smoke
Диван Коренс Happy Grey,38990,https://www.divan.ru/irkutsk/product/divan-korens-happy-grey
Диван угловой Шера Velvet Light,129990,https://www.divan.ru/irkutsk/product/divan-uglovoj-shera-velve-light
Диван Види Textile Ocean,31190,https://www.divan.ru/irkutsk/product/divan-vidi-textile-ocean
Кресло Пайл Barhat Beige,29890,https://www.divan.ru/irkutsk/product/kreslo-pajl-barhat-beige
Модульный диван Brera-2 Velour Mix,137780,https://www.divan.ru/irkutsk/product/modulnyj-divan-brera-2-velour-mix
Кресло Гета Soft Silver,40290,https://www.divan.ru/irkutsk/product/kreslo-geta-soft-silver
Диван угловой Нумо Velvet Yellow,61090,https://www.divan.ru/irkutsk/product/divan-uglovoj-numo-velvet-yellow
Модульный диван Нолан-B 3 Soft Jungle,149470,https://www.divan.ru/irkutsk/product/modulnyj-divan-nolan-b-3-soft-jungle
Кресло Элвит Cozy Ivory,38990,https://www.divan.ru/irkutsk/product/kreslo-elvit-cozy-ivory
Диван Сваут Velvet Mustard,84490,https://www.divan.ru/irkutsk/product/divan-svaut-velvet-mustard
Кресло Рибс Velvet Beige,35090,https://www.divan.ru/irkutsk/product/kreslo-ribs-velvet-beige
Пуф Кропс Bucle Smoky,11690,https://www.divan.ru/irkutsk/product/puf-krops-bucle-smoky
Пуф Лонди Cozy Beige,15590,https://www.divan.ru/irkutsk/product/puf-londi-cozy-beige
Диван Мисл Barhat Mint,97490,https://www.divan.ru/irkutsk/product/divan-misl-barhat-mint
Диван угловой Мейлон Velvet Eclipse,64990,https://www.divan.ru/irkutsk/product/divan-uglovoj-mejlon-velvet-eclipse
Диван Нумо Мини Textile Light,32490,https://www.divan.ru/irkutsk/product/divan-numo-mini-textile-light
Диван угловой Бонент Velvet Grey,116990,https://www.divan.ru/irkutsk/product/divan-uglovoj-bonent-velvet-grey
Диван Рейли Velvet Mint,48090,https://www.divan.ru/irkutsk/product/divan-rejli-velvet-mint
Диван Риббл-2 Bucle Lilac,89690,https://www.divan.ru/irkutsk/product/divan-ribbl-2-bucle-lilac
Диван угловой Маркфул Velvet Ocean,103990,https://www.divan.ru/irkutsk/product/divan-uglovoj-markful-velvet-ocean
Кушетка Роби Textile Coral,24690,https://www.divan.ru/irkutsk/product/kushetka-robi-textile-coral
Диван угловой Нумо Velvet Grey,61090,https://www.divan.ru/irkutsk/product/divan-uglovoj-numo-velvet-grey
Кушетка Оренте Soft Sky,53290,https://www.divan.ru/irkutsk/product/kushetka-orente-soft-sky
Пуф Бане Cozy Ginger,11690,https://www.divan.ru/irkutsk/product/puf-bane-cozy-ginger
Банкетка Аймо Textile Light,11690,https://www.divan.ru/irkutsk/product/banketka-ajmo-textile-light
